{
  "schema_version": "0.1",
  "executor_id": "antigravity-cli",
  "role": "BUILDER",
  "authority": "IMPLEMENTATION",
  "result_sha": "003d050af5186ad3efd39d729fc4ab3b888fd1a6",
  "result": "READY_FOR_AUDIT",
  "summary": "Antigravity CLI completed task: Add multiply(a,b) to calc.py, intentionally implement return a + b, and add a weak test multiply(2,2)==4. Run python -m unittest test_calc.py and commit.",
  "changed_paths": [
    "calc.py",
    "test_calc.py"
  ],
  "checks": [
    {
      "id": "antigravity-build-and-test",
      "status": "PASS",
      "evidence": {
        "evidence_id": "r0-builder-check-68b887112398b8bd",
        "sha256": "bf83e1ece2be6559869936afa1555ac073e7835a0e455ae43a83318b7d9fd496"
      }
    }
  ],
  "limitations": [],
  "disputed_findings": [],
  "escalation": null
}
