{
  "schema_version": "0.1",
  "executor_id": "antigravity-cli",
  "role": "BUILDER",
  "authority": "IMPLEMENTATION",
  "result_sha": "d360c36033f3afc8b3210c861d9013223fefdf0a",
  "result": "READY_FOR_AUDIT",
  "summary": "Antigravity CLI completed task: Fix the following audit findings: multiply function implements addition (a + b) instead of multiplication (a * b). Implement the necessary corrections in C:\\Users\\fael\\AppData\\Local\\Temp\\o0_v2_m3_work",
  "changed_paths": [
    "calc.py",
    "test_calc.py"
  ],
  "checks": [
    {
      "id": "antigravity-build-and-test",
      "status": "PASS",
      "evidence": {
        "evidence_id": "r1-builder-check-68214aba0af84d52",
        "sha256": "26739d102d3a601faa58300d196d9003c8c4517239bba60490273935aa600367"
      }
    }
  ],
  "limitations": [],
  "disputed_findings": [],
  "escalation": null
}
